{
  "$schema": "https://json-schema.org/draft/2020-12/schema",
  "$id": "https://fabric.passioncode.ai/agent-contract/0.1.0/schemas/delegation-token.schema.json",
  "title": "Delegation token claims (fabric-delegation/0.1, DEC-0039)",
  "description": "The decoded payload of a delegation token: a JWT (RFC 7519) signed by the estate hub with Ed25519 (alg EdDSA, RFC 8037), shaped as OAuth 2.0 Token Exchange (RFC 8693). The protected header is $defs/header. The issuer emits exactly these claims; a verifier ignores claims it does not know (RFC 7519 §4).",
  "type": "object",
  "required": ["iss", "sub", "act", "aud", "scope", "effect", "grant", "iat", "exp", "jti"],
  "properties": {
    "iss": { "$ref": "common.schema.json#/$defs/uri", "description": "The estate hub that signed the token; stable across key rotation and port changes (urn:fabric:estate:<estate id>)." },
    "sub": { "$ref": "common.schema.json#/$defs/uri", "description": "The principal: the person of the estate on whose behalf the work runs (the operator, or an external person under a share grant)." },
    "act": { "$ref": "#/$defs/actor", "description": "RFC 8693 §4.1 actor chain: the agent now calling outermost, each earlier agent nested inside (innermost only, under a partner grant, the partner actor, DEC-0090), at most four deep; a token for the meter (effect none) at most five (DL-6, DEC-0045)." },
    "aud": { "$ref": "common.schema.json#/$defs/agentId", "description": "Exactly one callee agent id, as a string, never an array." },
    "scope": {
      "type": "string",
      "maxLength": 4096,
      "pattern": "^[a-z][a-z0-9._-]{1,127}( [a-z][a-z0-9._-]{1,127})*$",
      "description": "RFC 8693 §4.2: space-delimited capability names (tool names) of the callee."
    },
    "effect": {
      "type": "array",
      "minItems": 1,
      "uniqueItems": true,
      "items": { "$ref": "common.schema.json#/$defs/effectClass" },
      "description": "The effect ceiling: the classes admitted, with none below every class and draft below every external class."
    },
    "grant": {
      "type": "array",
      "minItems": 1,
      "maxItems": 1,
      "items": { "type": "string", "minLength": 1, "maxLength": 256 },
      "description": "The opaque reference of the one grant the call is under (DEC-0045: one grant per token); a token for the meter keeps its parent's. A usage report's byGrant repeats it."
    },
    "spend": {
      "description": "What the grant had left when the token was minted. Informative: the meter's grant check decides, not this claim.",
      "oneOf": [
        { "type": "object", "required": ["mode"], "properties": { "mode": { "const": "unlimited" } }, "additionalProperties": false },
        {
          "type": "object",
          "required": ["mode", "remaining"],
          "properties": {
            "mode": { "const": "limited" },
            "remaining": {
              "type": "array",
              "minItems": 1,
              "maxItems": 6,
              "items": {
                "type": "object",
                "required": ["window", "remainingUsd"],
                "properties": {
                  "window": { "enum": ["total", "task", "project", "day", "week", "month"] },
                  "remainingUsd": { "type": "number", "minimum": 0 }
                },
                "additionalProperties": false
              }
            },
            "perCallMaxUsd": { "type": "number", "minimum": 0 }
          },
          "additionalProperties": false
        }
      ]
    },
    "project": { "$ref": "common.schema.json#/$defs/uri", "description": "Present when the grant is bound to a project." },
    "task": { "$ref": "#/$defs/task", "description": "DEC-0041: the issuing host's task the work runs under, set by the hub when the session or run has one; the meter keys the task window on it. An onward token keeps the parent's task or none, never another." },
    "iat": { "type": "integer", "minimum": 0 },
    "exp": { "type": "integer", "minimum": 0, "description": "At most 600 seconds after iat (FAC-SEM-049)." },
    "jti": { "type": "string", "pattern": "^[A-Za-z0-9._~-]{16,128}$" }
  },
  "additionalProperties": false,
  "allOf": [
    {
      "if": { "required": ["act"], "properties": { "act": { "type": "object", "required": ["act"], "properties": { "act": { "type": "object", "required": ["act"], "properties": { "act": { "type": "object", "required": ["act"], "properties": { "act": { "type": "object", "required": ["act"], "properties": { "act": true } } } } } } } } } },
      "then": { "properties": { "effect": { "const": ["none"] } } },
      "description": "DL-6 (DEC-0045): only a token for the meter has a fifth actor, and it reads only. That its audience is the meter and its scope the grant-check capability is FAC-SEM-050's and the meter's check, not the schema's."
    }
  ],
  "$defs": {
    "session": { "type": "string", "pattern": "^[A-Za-z0-9._:-]{1,128}$", "description": "An opaque id of the session the actor runs in, when it runs in one." },
    "task": { "type": "string", "pattern": "^[A-Za-z0-9._:-]{1,128}$", "description": "An opaque id of the issuing host's task, in the session id's grammar (DEC-0041)." },
    "header": {
      "type": "object",
      "required": ["alg", "typ", "kid"],
      "properties": {
        "alg": { "const": "EdDSA" },
        "typ": { "const": "fabric-delegation+jwt" },
        "kid": { "type": "string", "minLength": 1, "maxLength": 128 }
      },
      "additionalProperties": false
    },
    "actor": {
      "type": "object",
      "required": ["sub"],
      "properties": { "sub": { "$ref": "common.schema.json#/$defs/agentId" }, "session": { "$ref": "#/$defs/session" }, "act": { "anyOf": [{ "$ref": "#/$defs/actor2" }, { "$ref": "#/$defs/partnerActor" }] } },
      "additionalProperties": false
    },
    "actor2": {
      "type": "object",
      "required": ["sub"],
      "properties": { "sub": { "$ref": "common.schema.json#/$defs/agentId" }, "session": { "$ref": "#/$defs/session" }, "act": { "anyOf": [{ "$ref": "#/$defs/actor3" }, { "$ref": "#/$defs/partnerActor" }] } },
      "additionalProperties": false
    },
    "actor3": {
      "type": "object",
      "required": ["sub"],
      "properties": { "sub": { "$ref": "common.schema.json#/$defs/agentId" }, "session": { "$ref": "#/$defs/session" }, "act": { "anyOf": [{ "$ref": "#/$defs/actor4" }, { "$ref": "#/$defs/partnerActor" }] } },
      "additionalProperties": false
    },
    "actor4": {
      "type": "object",
      "required": ["sub"],
      "properties": { "sub": { "$ref": "common.schema.json#/$defs/agentId" }, "session": { "$ref": "#/$defs/session" }, "act": { "anyOf": [{ "$ref": "#/$defs/actor5" }, { "$ref": "#/$defs/partnerActor" }] } },
      "additionalProperties": false,
      "description": "The fourth actor is the last of a callee's token; only a token for the meter nests a fifth (DL-6)."
    },
    "actor5": {
      "type": "object",
      "required": ["sub"],
      "properties": { "sub": { "$ref": "common.schema.json#/$defs/agentId" }, "session": { "$ref": "#/$defs/session" } },
      "additionalProperties": false,
      "description": "The fifth actor, in a token for the meter only (effect none, DEC-0045): it carries no act."
    },
    "partnerActor": {
      "type": "object",
      "required": ["partner"],
      "properties": { "partner": { "$ref": "common.schema.json#/$defs/orgContextId" } },
      "additionalProperties": false,
      "description": "DEC-0090: the partner organization a company's owner granted, the innermost actor of a token minted under a partner grant (principalKind partner, FAC-SEM-124); never the outermost, it carries no act and counts toward DL-6's depth."
    }
  }
}
